{
  "request_id": "contract-turn",
  "turn_id": "2026-10-07/1",
  "kind": "user",
  "state": "waiting",
  "status": null,
  "generation_id": "generation_44d2321488a6400cbdcfbe8a5341d05d",
  "active_day": "2026-10-07",
  "accepted_at": "2026-10-07T06:42:47.446721+00:00",
  "started_at": "2026-10-07T06:42:47.446843+00:00",
  "finished_at": null,
  "reflection": null,
  "cancel_requested": false,
  "wait_reason": "budget",
  "question": {
    "question_id": "action_result_fa298cf0",
    "question": "Choose a direction",
    "details": "The implementation plan is ready for execution.",
    "options": [
      {
        "id": "a",
        "label": "Execute",
        "description": "Use the approved plan"
      }
    ],
    "allow_other": true,
    "text": "The implementation plan is ready for execution.\n\nChoose a direction",
    "timeout_seconds": null
  },
  "budget_request": {
    "request_id": "budget_d8c5feee190748feb110eb1fd9701b2b",
    "next_cycle_index": 3
  },
  "result": null,
  "jobs": [
    {
      "job_id": "20261007-1-1",
      "kind": "execution.process",
      "state": "running",
      "summary": "",
      "reason": "",
      "pending_inputs": [],
      "result_refs": [
        "workspace:jobs/20261007-1-1/logs/stdout.log",
        "workspace:jobs/20261007-1-1/logs/stderr.log"
      ]
    }
  ]
}
