{
  "request_id": "contract-turn",
  "turn_id": "2026-10-06/1",
  "kind": "user",
  "state": "finished",
  "status": "answered",
  "generation_id": "generation_b54437c9bfd74388b38c1efe4f219d78",
  "active_day": "2026-10-06",
  "accepted_at": "2026-10-06T15:04:14.379472+00:00",
  "started_at": "2026-10-06T15:04:14.379594+00:00",
  "finished_at": "2026-10-06T15:04:16.322575+00:00",
  "reflection": null,
  "cancel_requested": false,
  "wait_reason": null,
  "question": null,
  "budget_request": null,
  "result": {
    "request_id": "contract-turn",
    "turn_id": "2026-10-06/1",
    "active_day": "2026-10-06",
    "status": "answered",
    "output": {
      "text": "Finished response",
      "result_id": "action_result_a3bcd72e",
      "references": [],
      "metadata": {
        "action": "core.answer"
      }
    },
    "completion": {
      "kind": "answer",
      "result_id": "action_result_a3bcd72e",
      "text": "Finished response",
      "references": []
    },
    "failure": null,
    "finish_failures": [],
    "cleanup": []
  },
  "jobs": []
}
